,name,price,url,Sname,shops_name,reviews
10,ふるさと納税 鹿児島県産黒毛和牛赤身モモスライス (計2kg・500g×4P)　黒毛和牛 国産 肉 牛肉 赤身 モモ肉 小分け すき焼き しゃぶしゃ.. 鹿児島県志布志市,"28,000",https://store.shopping.yahoo.co.jp/furunavi/118134.html,鹿児島県産黒毛和牛赤身モモスライス 2kg ギフトセット,['ふるなび(ふるさと納税)'],"[<p class=""elItemCommentText"">年末年始のすき焼き用に注文しました。10/31に注文し、11/7に届きました。
（年末に間に合わないと最悪なので、余裕を持ちましたが、余裕過ぎました。。。
　でも冷凍庫スペースだけあれば、賞味期限が4月なので問題なし。）
きれいな霜降りで、年末年始が楽しみです。
[配送管理ID]　11397216</p>, <p class=""elItemCommentText"">人生初のふるさと納税をしました。
購入から届くまで長い期間で、4月の上旬というざっくりとした目安だったので運悪く冷凍食品をまとめ買いした直後に届きました。
無理矢理冷凍庫に詰め込みましたが、どうしても1パック入らなかったのでその場で焼いて食べてみました。
脂身が少なくて、表記の通り旨い＆ヘルシーな感じでした。
A5ランクには敵いませんが、スーパーの安売りしている肉よりは遥かに美味しく頂きました。</p>, <p class=""elItemCommentText"">パックで小分けで届きました。思いの外ボリュームが多く、冷凍庫に入らなかったので、パックから取ってラップに包みました。
家族で食べても食べきれないので、3回に分けてすき焼きにしました。脂身は少ないため、脂っこいのが苦手な人はいいのでは思います。
赤み肉だと、硬さか臭みが気になりますが、あまり硬くなく臭みは、ちょっと気になるかなくらいです。しゃぶしゃぶよりは好き焼きのほうがいいかもしれません。</p>, <p class=""elItemCommentText"">ふるさと納税で熊本のあか牛ブロックが届きました🥓
そこで今夜はローストビーフを作りました😊
焼き加減もバッチリ👍
熊本といえば、去年までおねぇたん👩‍⚕️がいた所☺️
やっぱ、熊本は美味しいものがいーっぱい😋
ローストビーフも、お肉の味が濃くて、
本当に美味しい😋🍴💗
ローストビーフなので、マッシュポテトも作り、
最高の夕食でした😉
あー、熊本行きたいなぁ❣️　九州行きたいなぁ♨💭</p>, <p class=""elItemCommentText"">黒毛和牛のもも肉。フライパンで強火で火を通して、わさび醤油で食べました。肉質は及第点程度ですが、コスパがとてもいいと思います。以前、銘柄のステーキ肉（コロコロステーキも含む）を家って失望したことがありましたが、この製品には満足です。ヘルシーとありますが、少しは脂身があります。すき焼きやしゃぶしゃぶには少し厚すぎると思います。
</p>]"
11,送料無料 肉 和牛 牛肉 切り落とし 牛すじ 国産黒毛和牛三冠盛り 霜降切り落とし もも肉切り落とし さばきすじ,"8,900",https://store.shopping.yahoo.co.jp/matador/sankan.html,国産黒毛和牛三冠盛り霜降切り落とし,['肉処 三代目本多'],"[<p class=""elItemCommentText"">いつも何を買おうか迷う中、このセットはいつも頼むものが全て入ってる感じで注文してみました。このセットに入っているさばきすじは長年のリピート品です。世の中の物価上昇もあり、もともと良品がお安く購入できたこともあり、当初より値上がりしましたがまだまだお世話になりたい商品です。三品それぞれストックにピッタリでいろいろな料理に使えます。リピート商品となりそうです。</p>, <p class=""elItemCommentText"">2度目の注文です。
1.6kg入っていて、クーポンも使えたので、お安く購入できました。

さばきすじ600gでシチューを作りました。たっぷりお肉を堪能できます。お肉も美味しいです。
他の2種のお肉も、切り落としでもすき焼きにできるくらい柔らかくてお肉の味がします。
家族で、美味しい牛肉が、お安くたっぷりたべられるので、また、クーポンがある時注文したいと思います。</p>, <p class=""elItemCommentText"">娘と彼氏の家にに送りました✨二人とも喜んでくれて、娘は、自分でビーフシチューまで作って画像で送ってくれました。いつも美味しお肉なので、間違い無いです</p>, <p class=""elItemCommentText"">さばきすじを辛いカレーに。
牛切り落とし・モモは硬くなく程よい油で、すき焼きなどに充分使えます。こんなにボリュームありで、安いからまた買います。</p>, <p class=""elItemCommentText"">さばきすじが美味しかったので、リピート買い。切り落としは味があって、霜降りであるなし、どちらも美味しいです。</p>]"
12,父の日 もも スライス すき焼き しゃぶしゃぶ 肉 焼しゃぶ 牛肉 焼肉 国産 黒毛和牛 和牛  モモ肉  ギフト　【4-5等級】【250ｇ×2パック】,"4,000",https://store.shopping.yahoo.co.jp/beef-fukushima/bf201102.html,父の日ギフト！国産黒毛和牛ももスライスすき焼きしゃぶしゃぶ肉 ×2パック,['ビーフふくしまYahoo!店'],"[<p class=""elItemCommentText"">GWに長男が帰省するので、たまには豪勢にすき焼きにしよう、ということで、ビーフふくしまさんに注文。そしたら翌日には届いてビックリ！しかもお肉もとてもやらわかくて美味しかったです。家族みんなで大満足でした。お店の迅速で丁寧な対応に感謝です！ありがとうございました。</p>, <p class=""elItemCommentText"">お正月に来れないと娘から連絡があり、何か孫たちが喜ぶ物があればと思いお肉を送りました。
すき焼きして食べたよ、お肉がとても柔らかくて美味しかったよとの嬉しい連絡がありました。
送った甲斐がありました。</p>, <p class=""elItemCommentText"">モモ肉ですがサシも入っていて綺麗なお肉でした。しゃぶしゃぶだとタイミングで少しパサつく事もありますが、すき焼きで食べると柔らかく脂身の苦手な娘達はロース肉よりこちらが美味しいと気に入っていました。</p>, <p class=""elItemCommentText"">ももとロースをすき焼きで食べ比べしてみました。私はロースのほうが柔らかくくて好きですが、家族の一人が桃のほうが噛んでいると味がでてきて桃のほうが好きだと言っています。どっちもおいしです
</p>, <p class=""elItemCommentText"">義理の父母に贈りました。
薄いお肉を焼肉にして素早く炙って食べるのが好きなのでこちらを。
美味しかったよ、と感想をもらいましたので、良かったのではないでしょうか？</p>]"
13,牛肉 赤身モモ肉 ブロック (500g) 冷凍 個包装 長期保存 使いやすい もも肉 低糖質 低脂質 高たんぱく ローストビーフ ステーキ バーベキュー BBQ 牛 赤身肉,"2,980",https://store.shopping.yahoo.co.jp/asagohan/red-meat-block500g-10.html,牛肉赤身モモ肉ブロック500g冷凍個包装,['美容と健康フード 朝ごはんラボ'],[]
14,ふるさと納税 茨城県 牛久市 【常陸牛】ももステーキ 500g ( 茨城県共通返礼品 ) 肉 牛肉 和牛 黒毛和牛 赤身 ステーキ 国産 国産牛 もも肉 焼肉 焼き肉 バー…,"11,000",https://store.shopping.yahoo.co.jp/furusatochoice/5252894.html,ふるさと納税茨城県牛久市常陸牛ももステーキ500g,['ふるさとチョイス'],[]
15,送料無料 ギフト ステーキ 最上級A5A4ランク 国産黒毛和牛もも肉ステーキ3枚〜5枚 450g 牛肉 赤身 贈答 福島牛,"4,500",https://store.shopping.yahoo.co.jp/matador/sandaime-45.html,送料無料 、最上級A5A4ランク 国産黒毛和牛もも肉ステーキ、450g,['肉処 三代目本多'],"[<p class=""elItemCommentText"">美味しそうなお肉到着しました。主人の誕生日に焼きます。赤身や差し多めなど3枚入っていました。A4A5和牛がこのお値段で買えてコスパです。梱包も丁寧で美しい。大変美味しく、主人も大満足、脂も赤身もお肉の美味しさを味わえました。</p>, <p class=""elItemCommentText"">こちらのお肉　離れて暮らす息子に送っています。今回で２回目ですが１度目の時に美味しいとの事でしたのでまたこちらのお肉にしましたが、ご時世でしょうかお値段が上がっていました。
以前は地元のお肉屋さんのお肉を買いクール便で送っていましたが、こちらの方が送料込みでお安かったので利用させていただきましたが、今後これ以上高騰が続くとどちらが良いのかわからなくなりますね。
このご時世色々高騰が続きお肉一つも考えながらになりそうです。
美味しいお肉ありがとうございました。</p>, <p class=""elItemCommentText"">岩塩、ブラックペッパー、バターを使用。ミディアムレアからミディアムくらいでそのまま食べました。程よい歯ごたえがあり、噛めば噛むほど濃厚な肉の味が広がります。肉を食べてる感じがすごくして、美味しかったです。個人的には食べた後の胃もたれ感もなく、こちらのお店のサーロインより好きです。またリピートしたいと思います。ただ、柔らかいお肉が好きな方や歯が弱い方にはおすすめしません。</p>, <p class=""elItemCommentText"">赤身だけどスゴイやわらかいです。固いと食べない子供もいつも美味しいと食べています。
いつもリブロースのお肉と一緒に頼むのですが、4人家族でちょうどいいです。
焼いて、少し残ったのを細かく切ってガーリックチャーハンにするのですが、時間が経っても柔らかくて美味しいです。</p>, <p class=""elItemCommentText"">愛犬と3人で頂きました。愛犬は味付け無しで焼いたものを嬉しそうに食べていました。岩塩と、大根と玉葱をおろし、ポン酢、醤油、酒などで作ったタレで美味しく頂きました。赤身なので柔らかくはないけど、その分脂身が少ないので良かったです。</p>]"
16,肉 牛肉 ギフト 黒毛和牛 極柔 もも すき焼き肉 1kg 化粧箱入り 牛 モモ肉 すき焼き 食べ物 プレゼント お中元 父の日 母の日 2024 お歳暮 最高級,"10,000",https://store.shopping.yahoo.co.jp/fujiwara11298/957435.html,極柔黒毛和牛ももすき焼き肉1kg,['有限会社 阿波牛の藤原'],"[<p class=""elItemCommentText"">柔らかく、脂は強すぎないが旨味がしっかりとあるため満足度が高い肉だと思います。
長年付き合いがある方へのお歳暮に送りました。
「歳を取ったので脂の強いお肉だと胃が疲れてしまうようになった」と言われたので、もも肉であるこちらを選択。
赤身と脂のバランスが良く、肉自体も柔らかいのでとても美味しく食べる事ができたとの感想を頂きました。
私自身も頂きましたが、くどくない脂の甘みとしっかりとした赤身部分の肉の旨味が丁度良く、すき焼きの出汁と良く合う味わいでした。</p>, <p class=""elItemCommentText"">贈り物にしたので味は分かりませんが、
発送日も指定できてよかったです。
お肉好きなお相手にも喜んでいただけました。
機会があれば、うちも頼んでみようと思います。</p>, <p class=""elItemCommentText"">贈り物として購入しました。
味は分かりませんが、日時か指定できることが非常に助かりました。
今度は自分用に購入したいです。</p>, <p class=""elItemCommentText"">火を加えてもずっと柔らかくて美味しいです。</p>]"
17,牛肉 赤身モモ肉 ブロック (4個 計2000g) 冷凍 個包装 長期保存 使いやすい もも肉 低糖質 低脂質 高たんぱく ローストビーフ ステーキ バーベキュー BBQ 赤身肉,"8,480",https://store.shopping.yahoo.co.jp/asagohan/red-meat-block2000g-10.html,赤身モモ肉ブロック2000g【4個入り】冷凍保存用【使いやすい個包装】,['美容と健康フード 朝ごはんラボ'],[]
18,父の日 プレゼント 和牛 モモ ブロック ローストビーフ BBQ キャンプ ギフト 牛肉 黒毛和牛 お肉 モモブロック モモ肉 【500ｇ】【4〜5等級】,"4,200",https://store.shopping.yahoo.co.jp/beef-fukushima/bf03.html,父の日ギフト！黒毛和牛ローストビーフモモブロック500g【4〜5等級】,['ビーフふくしまYahoo!店'],"[<p class=""elItemCommentText"">いつもは赤身のモモを利用してローストビーフを作っていましたが、子供の誕生日用に少し良い肉をと思いこちらを注文しました。サシが入っているので柔らかく脂の部分が甘くとても美味しいお肉でした。子供も今までで1番美味しかったと絶賛!もちろん家族皆であっという間に完食しました。またリピしたいです。</p>, <p class=""elItemCommentText"">この度は有難うございました。
今回二度目の購入・この前購入させて頂いてローストビーフにして皆さんにご馳走致しましたら大絶賛・又この前のお肉が食べたいとの申し出が有り今回リピートして購入して又皆さんに食べて頂いたら又大絶賛😊何だか一流のシェフに成った様で鼻高々・ほんとに申し分ないお肉を購入させて頂いて有難うございました。
又近い内に食べたいなぁ～のお言葉を残されて皆さん帰られました、近い内に又リピート致しますので宜しくお願い致します。福島・・最高😊頑張って・・・。</p>, <p class=""elItemCommentText"">梱包を開けた時にお肉の色の良さに嬉しくなり、調理する時に真空パックを開けて肉質を見た時に嬉しくなりました。そして、食べる時と食べた時に美味しさに嬉しくなる。
3回嬉しくなるお肉。素敵です！
そして、オマケがついていたのも嬉しかったです。
4回も嬉しくなるお肉、これはありがたすぎます！
またリピートします。
そして、価格的にも相当お得でした！
ありがとうございます！

福島の畜産がんばれ！！</p>, <p class=""elItemCommentText"">この度は有難うございました。
今迄他社の商品を購入していました、他社の商品も何時も間違いの無い美味しい商品でしたが今回初めて半信半疑で購入（他社より同じグラムで金額が少し高い）致しました、要望した通りのローストビーフ作るのにピッタシの四角いブロック・さしの入りも、出来上がって食べても最高に美味しく家族全員大絶賛でした。
次も必ず購入させて頂きます、有難うございました。
</p>, <p class=""elItemCommentText"">家族から、ローストビーフを作り大絶賛されました。こちらの商品が良かったこと間違いなしです。見るからに、さしが入っていて美味しそう。購入ページの写真そのものが届いたのですから。母の誕生日で作ったのですが、母も喜んで、柔らかくて美味しいと食べてくれました😋早速リピで注文してしまいました。また家族の幸せな顔が見られるのが楽しみです。</p>]"
19,ふるさと納税 【常陸牛】ももステーキ 500g ( 茨城県共通返礼品 ) 肉 牛肉 和牛 黒毛和牛 赤身 ステーキ 国産 国産牛 もも肉 焼肉 焼き肉 バーベ.. 茨城県牛久市,"11,000",https://store.shopping.yahoo.co.jp/furunavi/474402.html,茨城県牛久市 ふるさと納税常陸牛ももステーキ500g,['ふるなび(ふるさと納税)'],"[<p class=""elItemCommentText"">非常においしくいただきました。ボリュームも満点で、家族みんなで喜んでました。</p>]"
20,お中元 2024 早割 御中元 肉 ギフト牛肉 和牛 飛騨牛 赤身ステーキ 600g (120ｇ×5枚)  希少部位 もも肉 モモ ステーキ  父の日 プレゼント 食べ物  御礼 御祝,"9,000",https://store.shopping.yahoo.co.jp/nikunohiguchi-yafuu/ar-1.html,2024早割お中元和牛飛騨牛赤身ステーキ600g（120ｇ×5枚）,['肉のひぐち'],[]
21,ふるさと納税 鹿児島県産黒毛和牛赤身モモスライス (計1kg・500g×2P)　黒毛和牛 国産 肉 牛肉 赤身 モモ肉 小分け すき焼き しゃぶしゃ.. 鹿児島県志布志市,"15,000",https://store.shopping.yahoo.co.jp/furunavi/918631.html,ふるさと納税！鹿児島県産黒毛和牛赤身モモスライス500g×2P,['ふるなび(ふるさと納税)'],[]
22,肉 牛肉 ギフト 黒毛和牛 極柔 もも すき焼き肉 750ｇ 化粧箱入り 牛 モモ肉 すき焼き 食べ物 プレゼント お中元 父の日 母の日 2024 お歳暮 最高級,"8,000",https://store.shopping.yahoo.co.jp/fujiwara11298/957425.html,黒毛和牛極柔ももすき焼き肉750g【化粧箱入り】,['有限会社 阿波牛の藤原'],"[<p class=""elItemCommentText"">自宅のお正月用に頼みました。
配送もちゃんと指定した日時に届き、梱包もとても丁寧でした。
肝心のお肉も調理する30分前に解凍して調理しましたが、とても柔らかくて美味しく家族にも大好評でした。
また、機会があったら是非頼みます。</p>, <p class=""elItemCommentText"">お中元に贈りました。
指定の日時通りにお届け頂き、先方からとても良いお肉だとお礼の連絡がありました。
とてもご満足頂けた様子でしたので、また別の贈答の機会にも利用したいです。</p>]"
23,米沢牛 焼肉 モモ 600g 3〜5人前 肉 牛肉 和牛 国産 赤身 もも肉 ギフト 米澤牛 黒毛和牛 焼き肉 出産内祝い 結婚祝い 出産祝い 内祝い BBQ バーベキュー,"14,854",https://store.shopping.yahoo.co.jp/beliem/mg-10438-6.html,米沢牛 焼肉モモ600g 入りギフトセット【3〜5人前】,['ブランド和牛の百貨店 肉贈'],[]
24,ふるさと納税 北海道 上士幌町 ［022-H63］北海道　牛肉　赤身　ステーキ　サーロイン　モモ肉｜十勝ハーブ牛　サーロインとモモのステーキセット＜計700g＞　…,"22,000",https://store.shopping.yahoo.co.jp/furusatochoice/4822506.html,北海道牛赤身ステーキサーロインモモ肉セット【022-H63】【十勝ハーブ牛】,['ふるさとチョイス'],"[<p class=""elItemCommentText"">美味しくて満足。朝冷蔵庫に入れて夜には半解凍状態だったでしょうか。もう少し解凍してから焼けばよかったかと思いました。しかし、味は抜群に美味しかったです。おすすめ！</p>, <p class=""elItemCommentText"">真空パックでパッケージの見た目も美味しそうで良かったです。食べ応えあって夫婦でご馳走さましました。</p>]"
25,松阪牛 こま切れ 500g | 送料無料 肉 お肉 牛 お取り寄せ お取り寄せグルメ 国産牛 国産牛肉 取り寄せ 細切れ もも肉 バラ 牛バラ 牛もも肉 ロース |,"4,000",https://store.shopping.yahoo.co.jp/whats-beef/100056.html,送料無料！松阪牛こま切れ500g,['ワッツオンラインストアーYahoo!店'],"[<p class=""elItemCommentText"">牛肉大好きな叔母へのサプライズなお歳暮ものとして購入しました。

商品到着後、叔母から…
今までスーパーで買っていた牛肉とは次元が違うお肉だそうで。
お肉の柔らかさ、上品な味、この世のものとは思えない逸品だとも言っていました。

とても気に入ったようで早速、電話があり、500㌘ではなく１㌕を購入する予定です。</p>, <p class=""elItemCommentText"">さすがは松坂牛です。嫌な臭みはなく、脂の甘味があります。細切れですから、しゃぶしゃぶやすき焼きには利用できませんが、一口大の薄切りになっているので、その分手広くいろいろなものに使えます。塩と胡椒だけでさっと炒めて、大根おろしと食べるのは結構いけます。</p>, <p class=""elItemCommentText"">普通においしいお肉です。このお値段だと、その辺の焼肉屋さんに行けば軽く飛ぶ金額ですが、味わいは圧倒的にこちらの商品の勝ちでしょう。切り落としなので、いろいろな料理に活用できますし、塩と胡椒だけでササっと火を通して食べても美味いです。</p>, <p class=""elItemCommentText"">注文殺到だったようで、発送には通常よりも少し時間がかかったようですが、お問い合わせしたらすぐに返信いただけたので、良かったです。お肉はとっても美味しかったです。また購入したいと思います。</p>, <p class=""elItemCommentText"">何回かリピートしています。手軽に松坂牛を食べるにはちょうど良い商品です。小間切れということもありますので、塊をがっつり食べたい方には向きませんが、炒めて良し煮て良しだと思います。</p>]"
26,父の日 お中元 肉 牛肉 もも肉 すき焼き 国産牛 北海道産 神居牛 鍋 ギフト プレゼント お取り寄せ 北海道産神居牛モモすき焼き 400g,"2,280",https://store.shopping.yahoo.co.jp/senriya4129/k-momosukiyaki400.html,父の日 お中元北海道産神居牛ももすき焼き400g,['肉工房千里屋 Yahoo!店'],"[<p class=""elItemCommentText"">神居牛にすっかりハマっています。最近は油脂がちょっと苦手になったと言う者や、柔らかくないと食べられない者や家族の意見が色々で困っていましたがこちらのモモ肉は皆が満足で本当に美味しいです。</p>, <p class=""elItemCommentText"">
肉質も良くボリュームもあり食べ応えもあり
とても、良い買い物をしました。
なんども、リピしてしまいそうです。
おすすめ致します。</p>]"
27,国産 特選牛肉 ローストビーフ用モモ肉 ブロック 500g 冷蔵品 業務用,"4,600",https://store.shopping.yahoo.co.jp/syokuniku/v1-1.html,国産特選牛肉ローストビーフ用モモ肉500g 500g,['食肉本舗'],"[<p class=""elItemCommentText"">キレイにさしが入った牛肉のブロックが冷蔵で届きました。
常温で少し置いといてしっかり周りの水分をキッチンペーパーで拭いたあと強めに塩をふりフライパンで周りをこんがり焼いたあとジップロックに入れて炊飯器に60℃のお湯を半分入れて保温の状態で2時間低温調理。
その後ジップロックの袋のまま3時間キッチンテーブルの上で粗熱がとれるまで放置。
やっとカットしてみたらいい頃合のローストビーフに仕上がっていました。
肉汁もちゃんと閉じ込めてジューシーで
とても柔らかくしっとりでした。
この肉ならクリスマスディナーにも、
お正月のおせち料理にも使えそうなので
12月リピる予定です。</p>, <p class=""elItemCommentText"">しっとりとした最高に美味しいローストビーフが出来ました。</p>]"
28,ふるさと納税 ＜熊野牛＞すき焼き用赤身もも肉　1kg / 和歌山 田辺市 本宮 肉 牛肉 熊野牛 和牛 すき焼き すきやき しゃぶしゃぶ 鍋 冷凍 ギフ.. 和歌山県田辺市,"25,000",https://store.shopping.yahoo.co.jp/furunavi/1179124.html,熊野牛すき焼き用赤身もも肉1kg【ふるさと納税】,['ふるなび(ふるさと納税)'],[]
29,飛騨牛焼肉 もも かた肉 牛肉 もも肉 焼肉 焼き肉 冷凍 食品 焼き肉 バーベキュー 350ｇ ブランド牛 父の日 母の日 ギフト 送料無料 中元 御中元 歳暮 御歳暮,"5,400",https://store.shopping.yahoo.co.jp/otoshuclub/8200279.html,飛騨牛焼肉もも肉350g【冷凍】バーベキューギフトセット【飛騨牛牧場直送】,['おとなの週末 お取り寄せ倶楽部'],"[<p class=""elItemCommentText"">贈り物用に購入しました。お礼の連絡があったので味も柔らかさも好評だったと思います。今度は自分達が食べたいです。</p>, <p class=""elItemCommentText"">いつも食べているお肉と違って、柔らかくジューシーでした。子供と一緒に美味しく頂きました。ご馳走様でした。</p>, <p class=""elItemCommentText"">コロナ禍でここ数年実家に行けずにいたので贈りました。とても喜んでくれていたので購入して良かったです。</p>]"
