,name,price,url,Sname,shops_name,reviews
0,牛肉もも肉 1kg ブロック　冷凍品  豪州産 ローストビーフやステーキ用に 赤肉 赤身 ランプ アメリカンビーフ モモ肉,"2,538",https://store.shopping.yahoo.co.jp/dansyaku/10000344.html,豪州産牛もも肉1kgブロック,['そうざい 男しゃく'],"[<p class=""elItemCommentText"">今回で3回目の購入！！
今回も焼肉として購入です。
ハズレなしヘルシーであっさり！
ワサビ・岩塩で毎回、美味しくいただいてます。
</p>, <p class=""elItemCommentText"">商品無事受け取りました(*^^*)
ブロックで購入しちゃいました。しゃぶしゃぶ用にスライスされているお肉は高級なので赤身の多いもも肉ならコスト的にもGoodです。しかし、スライス肉は探しても質問しても加工不可なので、物価上昇を考え牛肉、豚肉のブロックがお得に購入出来るなら、家庭用ミートスライサーの購入も考え出しました。冷凍のまま好きな厚さで使う分だけスライス出来れば、全て結果オーライですよね(^^;;確かに加工されてるよりブロックの方が安く、手切りでは薄く切れないなら、お肉をコストダウンした分スライサーを購入すれば、すぐに元が取れますよね…と届いたブロック肉を見ながら真剣に考えてます。とても良いブロックなのでローストビーフ…よりしゃぶしゃぶや焼いて食べたい商品です( ‘-^ )b
またお願い致します(*^^*)</p>, <p class=""elItemCommentText"">牛肉を思いっきり食べてみたくて、地元のスーパーで買うより安く、配送で家に届けてくれるので、思い切って1kgの塊肉を人生で買ってみました。解凍には時間がかかりましたが、半解凍の時にスライスすると、焼肉にちょうどいい厚さで薄く綺麗に切れました。分厚いステーキスタイルでも楽しみ、精神的にも満足しました。一人で1回では食べきれませんでしたので、何回かに分けて楽しめて嬉しかったです。
味ですが、ランプ肉なんですが、サシが入っていてとてもジューシーで美味しかったです。お米と一緒に書き込むと最高です。
お値段満足できるお肉でした。オススメです。</p>, <p class=""elItemCommentText"">すごく気に入っています。冷凍で届いて二日間かけて冷蔵庫内で解凍してから調理しています。前回、タタキを作りました。家族にも好評でした。今まで使ってきた牛肉の半額に近いと伝えると更に驚かれました。薄く切って食べていますし、硬いと感じる事はありませんでした。とても美味しいお肉でした。地元のお肉屋さんで買うと高いし、スーパーではブロック肉は貴重です。またこちらで購入させていただきたいです。</p>, <p class=""elItemCommentText"">柔らかく、美味しく頂きました。毎年、ローストビーフを作っていますが、今までで、一番美味しく、焼けました。脂部分も切り取って、煮込みを作ってみました。二種類の料理を楽しみました。正直、ここまで美味しい肉が届くとは思っていませんでした。買って良かったです。</p>]"
1,ステーキ 牛肉   めす牛 上赤身 もも肉 ブロック 1kg 焼肉 牛肉 国産黒毛和牛 A4 ランク 高級 ギフト お取り寄せ 1キロ,"8,970",https://store.shopping.yahoo.co.jp/gyuusyouotochan/oto017.html,国産黒毛和牛A4 ランク めす牛上赤身もも肉ブロック1kg【高級ギフト】,['牛匠乙ちゃん 牛肉 ステーキ 焼肉 専門店'],"[<p class=""elItemCommentText"">黒毛和牛のもも肉としては一般的なレベルのサシが入っていました。お味は値段からするとかなり良い方(100g1000円レベル？)ではないかと思います。
1kgを注文し、500gが1つだけ届きました。夜の遅い時間に連絡したらすぐに返事をいただき、不足分とお詫びの品を一緒に送っていただけるとのことでした。霜降りカルビを250gとタレを一緒に送ってくださいました。ありがとうございました。
もも肉は画像の右側。</p>, <p class=""elItemCommentText"">この度はありがとうございました。
ご注文してから到着まで、あっという間でした。

今まで購入した、どの商品よりも、柔らかくお肉の味もすごく良く、大・大満足です！！
我慢出来なくて、到着してからおいしく解凍しかかった所を、そーっと切ってお味見してしまった所です(^^;
絶対リピートしたいと思います。お値段もこんなにいい商品なのに、とても良心的で嬉しいです。
お店の中には、まだ色々な商品があります。是非いろんなお肉を購入してみたいです。
また是非宜しくお願いします。</p>, <p class=""elItemCommentText"">解凍も指示どおりにやればスムーズにでき、ステーキでいただきました。
外国産のモモ肉のようなパサつきがなく、十分ジューシーでしかも噛みごたえ
もあり、肉の美味しさを楽しめました。
1kgもあると家族みんなで食べてもたっぷりの分量で、外食でステーキを食べるよりもずいぶんお得だと感じました。</p>, <p class=""elItemCommentText"">ブロック肉を初めて購入。
解凍後にステーキサイズに切り分けましたが、赤身肉ですが簡単に切り分ける事が出来ました。
これぞももステーキといったお肉で、程よい硬さと臭みのない味でとても美味しかったです。
また購入したいと思います。</p>, <p class=""elItemCommentText"">クリスマスのメインにローストビーフで楽しみました。下味は塩胡椒のみ、炊飯器でゆっくり加熱。 スジがなく、サシの入り具合が絶妙で最後の一切れまで柔らかく、美味しく頂きました。家族満場一致でリピート決定しました。</p>]"
2,松阪牛 こま切れ 1000g | 送料無料 松坂牛 牛肉 お取り寄せ お取り寄せグルメ すき焼き 国産牛 国産牛肉 細切れ もも肉 牛バラ |,"5,680",https://store.shopping.yahoo.co.jp/whats-beef/nikuevent-100056-1000g.html,送料無料！松阪牛こま切れ1000g【国産牛肉 すき焼き用グルメ】,['ワッツオンラインストアーYahoo!店'],"[<p class=""elItemCommentText"">こま切れとはいえさすがは松阪牛、なのであえてしゃぶしゃぶと、すき焼きでいただきました。
しゃぶしゃぶの方は、やはりこま切れなので正直物足りなさを感じましたが、すき焼きではさすがの美味しさを充分に堪能することが出来ました。
証明書付きというのがハクがついて、より美味しさを倍増した気になって(笑)良かったです。
少し余ったので、牛丼にすると、やはりスーパーのお肉とは段違いの美味しさ。
より一層の違いを感じる事ができました。
</p>, <p class=""elItemCommentText"">柔らかさ、脂身、味。全てにおいて細切れ肉と言えど、さすが松坂牛！と思う満足度です。最初は少し贅沢に！という時に購入しましたが、このご時世で普段買いの肉も値上がりし、溜まったポイントとポイント還元日を合わせて購入すると結果、100gあたりのお値段が普段の肉と差ほど変わらない事に気づき、それ以降こちらの商品をリピートしてます♪なんといっても1Kgですからね〜♪夫婦2人なので量も申し分なく、細切れ肉なので色々な料理に使えて助かってます。ただの料理にこちらの松坂牛を使用するだけで味が勝手にランクアップされるので色々な意味で、お得感！満足感しかありません。</p>, <p class=""elItemCommentText"">お気に入りの松坂牛専門店が数店あるのですが、昨今の社会的状況で訪問できなくなりこの際直販でお願いしようと発注させていただきました。
幾多の種類の美味しい牛肉に出会ったりもしたのですが、個人的にはやはり松坂牛独特の甘美な美味しさが時々無性に恋しくなります。
早速、試し調理させていただきましたが「これこれやっぱりこの味！」と思わせてくれる、料理の可能性が大幅に拡がる深い味わいでした。
製品には個体識別番号が添付され生産者の皆様の顔も見え、とても真摯に取り組まれている様子が伺えました。
良いショップに出会えた様で嬉しいです。</p>, <p class=""elItemCommentText"">即発送くださり、ありがとうございました。でっかいパック２つで届きました。切り落としではあるけれど、まずはすき焼きで。スーパーの安売りの肉とは、さすがに味わいが違いました。風味といいますか、甘味？深み？とても美味しい。松阪牛で焼き肉なんてのもやってみようと思います。脂が多く含まれる肉だし、焼き肉なら脂を少しキッチンペーパーなどで吸い取るといいかな。でもそれももったいないかな。まだたくさんあるので、これから楽しませていただきます。</p>, <p class=""elItemCommentText"">こちらのショップで初めて購入しました。
松阪牛は大好きですが、高価な為にあまり食べる機会が少ないです。
今年は大変暑く、夏バテ気味の家族に体力をつけてもらおうと牛肉を探していたところ、こちらのショップを見つけました。
発送も早くて、とても綺麗なお肉が2パック届きました。
すき焼きにすると、家族で取り合いになるほどでした。
すぐになくなると思うので、またお得な時に購入したいと思います。</p>]"
3,肉 牛肉 ブロック 和牛 塊 飛騨牛 もも肉 1kg かたまり 赤身 ローストビーフ  黒毛和牛 煮込み料理 赤身肉  ステーキ,"11,800",https://store.shopping.yahoo.co.jp/nikunohiguchi-yafuu/13411.html,飛騨牛もも肉1kgかたまり,['肉のひぐち'],"[<p class=""elItemCommentText"">肉の固まりを買い求めるのが面倒くさかったです。２００㌘きらいに切りました。冷蔵で届きましたから切りやすくそれぞれラップし冷凍庫に保管しました。最初の一枚を塩胡椒にてレアで食べました。最高に美味しいですね。</p>, <p class=""elItemCommentText"">いつも妻が購入しているのですが、今回は私の方でオーダーしました。&amp;#92;nこちらのお肉は本当にきれいなサシが入ったお肉で、いつも、美味しいです。&amp;#92;n電話で３つにカットをお願いしたのですが、対応していただき、感謝しております。&amp;#92;nこのお肉で、牛のタタキを作っています。今回も楽しみです。&amp;#92;nありがとうございました。</p>, <p class=""elItemCommentText"">先日500gブロックを買ってタタキにしました。
もも肉とは思えないほどのサシが入って柔らかく、気に入ったので1kgブロックを注文してみました。
一部は1.5cmほどの厚さのステーキにして食べてみたら硬くて噛みきれなくてショックでした。
筋肉繊維に直角に切ったのに。
味は良いのでまたリピートしようと思いますが、硬かったのはショックでした。</p>, <p class=""elItemCommentText"">絶対、裏切らない。  いつもは、500グラムのブロックを
注文して居ました。  今回は、1キロにしてみました。
（≧∇≦）迫力ある！自分の誕生日にローストビーフを焼きました。  美味しい‼️豪華‼️  家族でお腹一杯になりました。  本当に絶対美味しい 綺麗なお肉です。</p>, <p class=""elItemCommentText"">今年２回目の注文でした。
相変わらず、いいサシの入った、美味しそうなお肉でした。
年末、年始のパーティー用に、たたき用として、オーダーしました。
今回もいい感じでできました。
今後もよろしくお願いします</p>]"
4,父の日 プレゼント 和牛 あかみ ステーキ 赤身 モモ肉 ステーキ肉  ギフト 肉 牛肉 黒毛和牛  国産  もも ミニステーキ 【4枚入り400ｇ】【4〜5等級】,"3,200",https://store.shopping.yahoo.co.jp/beef-fukushima/bf200701.html,父の日ギフト！和牛あかみステーキモモ肉 国産黒毛和牛ミニステーキ【4枚入り400g】【4〜5等級】,['ビーフふくしまYahoo!店'],"[<p class=""elItemCommentText"">ロースステーキが家族に評判が良かったので、今回は牛カツに挑戦してみたく赤身ステーキを頼みました。こちらの牛肉は臭みがないので、とても食べやすいです。真空で届くので、そのまま冷凍庫へ入れられるのも助かりました。あまり牛肉では喜ばない娘ですが、牛カツサンドにしたら大喜びでペロリでした。また注文したいと思います。</p>, <p class=""elItemCommentText"">ちょっと筋がある部分はありますが、十分に柔らかく美味しいお肉です。ヒレと比べるとそれなりではありあますが、値段もそれなりなので。。。コスパを考えるととてもいいのではないかと個人的には思いました。以前に九州産の牛のもも肉ステーキを頼みましたが、味はこちらの方が全然美味しかったです。</p>, <p class=""elItemCommentText"">届いてからすぐに冷蔵庫に入れ、ゆっくり解凍しました。モモステーキということで、固いのかなと思っていましたが、柔らかくて美味しいお肉でした。残ったものはビーフカツにして、お弁当のおかずになりました。ありがとうございました。</p>, <p class=""elItemCommentText"">年齢的に赤身の方を注文しましたが思った以上に良い意味でのサシが入っていました。
着日のご相談にも丁寧な回答いただき満足しています。
会社仲間で定期的に実施するおっさんキャンプ会のヘビロテに仲間入りしそうな予感です。</p>, <p class=""elItemCommentText"">牛カツサンドの投稿を見て食べたくなったので、真似して作って食べました。脂身も少なく肉も柔らかく、肉自体の味もしっかりしててとても美味しかったです。胃もたれをすぐする私にはこのお肉は食べやすかったです。</p>]"
5,ステーキ 牛肉   めす牛 上赤身 もも肉 ブロック 500g 焼肉 牛肉 国産黒毛和牛 A4 ランク 高級 ギフト お取り寄せ,"5,160",https://store.shopping.yahoo.co.jp/gyuusyouotochan/oto016.html,国産黒毛和牛A4ランクめす牛 上赤身ステーキブロック500g,['牛匠乙ちゃん 牛肉 ステーキ 焼肉 専門店'],"[<p class=""elItemCommentText"">毎年ローストビーフを作っていますが、毎年違うお店で買っていました。
偶然見つけましたが、完全に大アタリ！
肉の旨味が素晴らしく、柔らかくスジもほぼありません。 
販売している会社も、山手通りを目黒から五反田方面に走っていると、首都高五反田出口付近左側にある、焼き肉乙ちゃんを経営している会社の様子。
実店舗で焼き肉を提供している会社ということで信頼性も高いです。
もちろん、個体差もあるとは思いますが、自分の食べたお肉は大当たりでした。
お気に入りにいれたので、来年ローストビーフをまた作るときには是非リピートさせていただきます。</p>, <p class=""elItemCommentText"">ありがとうございました！ブロック初めて頼みましたが、とても美味しかったです♪大きいお肉を切って、塩胡椒で焼いて食べました！厚みがあるので、かたいかなって思いましたが、柔らかくて美味しかったです(^-^)量もみんなで食べたら丁度良かったです♪</p>, <p class=""elItemCommentText"">ローストビーフを作りました
周りをサッと焼いてからジプロックにタレ（酒、みりん、醤油）と一緒に入れ
低温（７８℃）で１時間調理後、冷蔵庫で二日寝かせます（和食料理長のレシピ）
柔くて筋がなくて美味しい肉でした
牛さん、命を頂いて感謝です。</p>, <p class=""elItemCommentText"">何度も注文しているリピーターです。黒毛和牛の旨味を感じる赤身肉で硬く無いしとても美味しく食べられます。基本的には焼いて塩コショウがシンプルで肉の旨味を味わえるかな、あとはやはりローストビーフにして食べたりしています。</p>, <p class=""elItemCommentText"">過去にも何度も注文した事があります。赤身肉だけど多少刺しも入っていて柔らかく今回はカットして焼いて食べました。塩を付けて食べたけど肉本来の味が楽しめて美味しかった。</p>]"
6,牛肉 赤身モモ肉 ブロック (2個 計1000g) 冷凍 個包装 長期保存 使いやすい もも肉 低糖質 低脂質 高たんぱく ローストビーフ ステーキ バーベキュー BBQ 赤身肉,"4,980",https://store.shopping.yahoo.co.jp/asagohan/red-meat-block1000g-10.html,赤身モモ肉ブロック1000g【冷凍】【使いやすい】【低糖質】【低脂質】【高たんぱく】,['美容と健康フード 朝ごはんラボ'],[]
7,干し肉 400g ほし肉 津山 岡山 熟成肉 牛肉 赤身 牛もも肉 ギフト 贈答 お中元 お歳暮 ドライ エイジングビーフ 岡山県産牛肉 清麻呂 津山名物 ひとはらの干し肉,"3,700",https://store.shopping.yahoo.co.jp/nikubaru/hoshiniku400.html,津山名物清麻呂 津山ひとはらの干し肉400g【岡山熟成肉ギフト】,['ひとはらの干し肉～おうちで肉バル～'],"[<p class=""elItemCommentText"">干し肉と言ってもパサパサではなく、旨味を凝縮したステーキを食べてるみたいでました。
フライパンで軽く炙って、ワサビ醤油で食べると最高です。</p>, <p class=""elItemCommentText"">美味しいです。赤身モモ肉ですが適度に油も入り、塩味があり、味が凝縮しています。パーティで出しましたが、「旨い！」と高評価でした。噛み具合も肉好きには丁度良い固さで、サシのいっぱい入ったステーキよりお肉の質感があり、うまみが味わえます。外で冷めてつまみで食べるにはトースターで焼いた方が良いような気がします。家で焼きたてを食べるのはフライパンで焼く方がボリューム感が出るように思います。美味しいものに出会うのはとてもうれしいことです。
調味料は塩はもう要らない、しょう油も好みで食べるときに付ければよい、ブラックペッパーも好みで、すべて好みで付ければ良く、何もつけなくても旨味でいただけます。</p>, <p class=""elItemCommentText"">スライスして焼いたり、グリルで丸焼きも試しましたが、
肉がパサつきますし、旨みが逃げます。
それでもまあ、それなりに美味しいわけですが・・・。

厚切りの肉をレアステーキするように
極高温の鉄フライパンに油をしいて
塊のまま、表面だけを短時間揚げ焼き。
スライスして、バルサミコ醤油で頂くと
外はカリっ。中はしっとり、じゅわっと肉汁。
適度な噛み応えがあり、至福です。

なので肉塊にある程度の厚みがほしい。
減点はここだけです。</p>, <p class=""elItemCommentText"">馬刺しやステーキ肉など、多くの肉をネットで買ってきましたが、そのほとんどがハズレでした。
この熟成肉は素人でもわかるくらい旨味が濃縮されており、とても柔らかく美味しく頂くことができました。

解凍し一口大に切りフライパンで焼くだけの簡単調理です。
個人的には何もつけなくても十分でした。
物足りなければ塩かわさびがいいかも。
機会があればまたリピします。</p>, <p class=""elItemCommentText"">日曜日に注文して火曜日にはもう届きました。
2時間くらい解凍して早速晩御飯で！
肉200gと切ったアスパラガス2束をフライパンで焼き、味付けは黒胡椒のみで。
肉の旨味と塩味で大人も子どもも美味しくいただきました。硬すぎず、柔らかすぎずよかったです。
あと半分残ってるのも食べるのが楽しみです。</p>]"
8,和牛 赤身 肉 国産黒毛和牛もも肉切り落とし1kg 送料無料 すき焼 焼肉 牛肉 A5A4ランク 訳あり こま切れ,"7,200",https://store.shopping.yahoo.co.jp/matador/sandaime-8.html,国産黒毛和牛もも肉切り落とし1kg【訳あり】,['肉処 三代目本多'],"[<p class=""elItemCommentText"">日時指定通り届きました。今日戴くのでお味はまだわかりませんが梱包そして見た目は完璧です！ 
写真広告にここまで類似した精肉は色々ネットで今迄購入してきましたけど間違いなく私の中ではNo. 1です！この見た目から美味しくないお味は想像出来ないです！ 手書きメッセージも添えられていて良心的なショップさんです！必ずまたリピートすると思いますけど唯一の心配は売り切れ！になる事ですね！良い商品を届けて頂きありがとうございました！m(__)m</p>, <p class=""elItemCommentText"">切り落としとなっていましたが 正規のすき焼き用のカットが殆どで 切り落としと思える部位は ほんのわずかでした箸で持ち上げると25、6センチの迫力の綺麗なカットでした 肉豆腐の材料を用意して到着を待っていましたが 急遽すき焼きに変更しましたラッキーな気分！赤身が柔らかくて大変美味しく頂きました 有り難う御座いました</p>, <p class=""elItemCommentText"">脂身が苦手なので
今回もも肉を購入しました。
すき焼きにしようと思ってましたが
息子が焼いて食べたいと言うので
一枚を3枚に切ってフライパンで少しずつ焼きながら食べました。
いつも通り塩で食べましたが
肉肉しい感じで
炒めた新玉ねぎを巻いて食べた方が美味しいと思いました。
すき焼きの方が美味しかったかな？</p>, <p class=""elItemCommentText"">リピーターですが、今回初めて赤身もも切り落としを購入しました。切り落としとは思えない綺麗な１枚物で、母親の退院祝いですき焼きで食しました。割り下で味付けしお肉だけ先に頂きましたが、本当に美味しいお肉です。同梱で購入した和牛切り落としを野菜と炊き、堪能しました。友人にも、オススメしました。</p>, <p class=""elItemCommentText"">この価格で、この高品質！
ロースと一緒に購入しましたが、我が家ではこのもも肉が好評でした。
すき焼きの前にさっと焼いて柚子胡椒でいただきましたが、柔らかく、美味しいお肉でした。
すき焼きでも、脂身が少なめなので、6人で、1.5kg完食！
また、利用させていただきます！</p>]"
9,黒毛和牛 霜降り 極柔 モモ ブロック 500g 最高級黒毛和牛 モモ肉 牛肉,"7,451",https://store.shopping.yahoo.co.jp/fujiwara11298/10001023.html,極柔黒毛和牛霜降りモモブロック500g,['有限会社 阿波牛の藤原'],"[<p class=""elItemCommentText"">冷凍の物と一緒に購入したので冷凍て届きました。ゆっくり解凍してローストビーフにしていただきました。柔らかくてとても美味しいお肉でした。</p>, <p class=""elItemCommentText"">全体にさしが入ってて柔らかくて本当に美味しいお肉でした。ローストビーフにしたのですが、形もきれいでちょうど良い大きさで作りやすかったです。また絶対に買うと思います。御馳走様でした。</p>, <p class=""elItemCommentText"">ホントに美味しかったです
ローストビーフにしましたが
もうないの？とリクエストされました
また買いたいと思います</p>]"
